{
  "schemaVersion": "gps-annotation-schema-v1.0.0",
  "corpusVersion": "gps-v1.0.0-draft.1",
  "corpusProductId": "gpsv1-0001",
  "annotationVersion": "1.0.0",
  "status": "needs_review",
  "changeReason": "Initial evidence-conservative annotation from repository provenance, metadata inspection, and direct visual inspection.",
  "sourceReference": {
    "referenceId": "gpsref-0001",
    "repositoryRelativePath": "public/products/kahve-deri.jpg",
    "contentHash": "sha256:cf5d4f1442cbeb27d1757ce8887af3e78cd070093a42c252e0f12dcec2f5d418",
    "sourceType": "repository_product_asset",
    "sourceOriginality": "original_reference",
    "originalityReviewStatus": "needs_operator_confirmation",
    "sanitizationStatus": "reviewed_no_action",
    "reviewStatus": "needs_review"
  },
  "classification": {
    "productFamily": "sneaker_lifestyle",
    "familyConfidence": 0.91,
    "confusionCandidates": ["sports_shoe", "casual_closed_shoe"],
    "inclusionSignals": [
      "Low-top closed upper",
      "Visible lace closure",
      "Panelled casual sneaker construction",
      "Relatively flat rubber-like sole profile"
    ],
    "exclusionSignals": [
      "No operator-confirmed intended-use metadata",
      "No medial, outsole, or pair view"
    ],
    "state": "inferred",
    "provenance": "machine_inferred"
  },
  "referenceSufficiencyMap": {
    "mapVersion": "gps-reference-sufficiency-v1.0.0",
    "overallReadiness": "needs_operator_review",
    "regions": [
      { "region": "toe", "visibility": "clearly_visible", "evidenceReferenceIds": ["gpsref-0001"], "viewpointLimitations": ["Lateral profile limits exact toe-box width"], "absenceCanBeEstablished": false, "confidence": 0.88, "conflicts": [] },
      { "region": "vamp", "visibility": "partially_visible", "evidenceReferenceIds": ["gpsref-0001"], "viewpointLimitations": ["Laces obscure the centerline"], "absenceCanBeEstablished": false, "confidence": 0.75, "conflicts": [] },
      { "region": "opening", "visibility": "clearly_visible", "evidenceReferenceIds": ["gpsref-0001"], "viewpointLimitations": ["Interior depth is not visible"], "absenceCanBeEstablished": false, "confidence": 0.86, "conflicts": [] },
      { "region": "heel_back", "visibility": "partially_visible", "evidenceReferenceIds": ["gpsref-0001"], "viewpointLimitations": ["Rear seam and center back are not directly shown"], "absenceCanBeEstablished": false, "confidence": 0.68, "conflicts": [] },
      { "region": "medial_side", "visibility": "not_visible", "evidenceReferenceIds": [], "viewpointLimitations": ["Single lateral view only"], "absenceCanBeEstablished": false, "confidence": 0, "conflicts": [] },
      { "region": "lateral_side", "visibility": "clearly_visible", "evidenceReferenceIds": ["gpsref-0001"], "viewpointLimitations": [], "absenceCanBeEstablished": true, "confidence": 0.96, "conflicts": [] },
      { "region": "sole_edge", "visibility": "clearly_visible", "evidenceReferenceIds": ["gpsref-0001"], "viewpointLimitations": ["Exact physical thickness cannot be measured without scale"], "absenceCanBeEstablished": true, "confidence": 0.92, "conflicts": [] },
      { "region": "outsole", "visibility": "not_visible", "evidenceReferenceIds": [], "viewpointLimitations": ["Underside is outside the viewpoint"], "absenceCanBeEstablished": false, "confidence": 0, "conflicts": [] },
      { "region": "seams", "visibility": "clearly_visible", "evidenceReferenceIds": ["gpsref-0001"], "viewpointLimitations": ["Medial and rear seam paths are unknown"], "absenceCanBeEstablished": false, "confidence": 0.9, "conflicts": [] },
      { "region": "hardware", "visibility": "ambiguous", "evidenceReferenceIds": ["gpsref-0001"], "viewpointLimitations": ["Eyelet material cannot be resolved confidently"], "absenceCanBeEstablished": false, "confidence": 0.42, "conflicts": [] },
      { "region": "ornaments", "visibility": "partially_visible", "evidenceReferenceIds": ["gpsref-0001"], "viewpointLimitations": ["Only lateral upper is shown"], "absenceCanBeEstablished": false, "confidence": 0.62, "conflicts": [] },
      { "region": "material_regions", "visibility": "clearly_visible", "evidenceReferenceIds": ["gpsref-0001"], "viewpointLimitations": ["Material composition cannot be authenticated visually"], "absenceCanBeEstablished": false, "confidence": 0.84, "conflicts": [] },
      { "region": "color_regions", "visibility": "clearly_visible", "evidenceReferenceIds": ["gpsref-0001"], "viewpointLimitations": ["No calibrated color target or lighting metadata"], "absenceCanBeEstablished": false, "confidence": 0.89, "conflicts": [] },
      { "region": "pair_handedness", "visibility": "not_visible", "evidenceReferenceIds": [], "viewpointLimitations": ["Only one shoe is shown"], "absenceCanBeEstablished": false, "confidence": 0, "conflicts": [] },
      { "region": "overall_silhouette", "visibility": "clearly_visible", "evidenceReferenceIds": ["gpsref-0001"], "viewpointLimitations": ["Top-view width and rear symmetry are unavailable"], "absenceCanBeEstablished": false, "confidence": 0.91, "conflicts": [] }
    ]
  },
  "productIdentityFingerprint": {
    "fingerprintVersion": "gps-pif-v1.0.0",
    "status": "draft_not_authoritative",
    "digest": null,
    "components": [
      { "factId": "fact-family.candidate", "path": "family.candidate", "value": "sneaker_lifestyle", "state": "inferred", "provenance": "machine_inferred", "confidence": 0.91, "evidenceReferenceIds": ["gpsref-0001"], "operatorConfirmed": false, "notes": "Requires operator family confirmation." },
      { "factId": "fact-silhouette.lowtop", "path": "silhouette.height", "value": "low_top", "state": "inferred", "provenance": "directly_visible", "confidence": 0.92, "evidenceReferenceIds": ["gpsref-0001"], "operatorConfirmed": false, "notes": "Visible in lateral profile." },
      { "factId": "fact-closure.laces", "path": "closure.primary", "value": "laces", "state": "inferred", "provenance": "directly_visible", "confidence": 0.98, "evidenceReferenceIds": ["gpsref-0001"], "operatorConfirmed": false, "notes": "Visible but not operator-confirmed." },
      { "factId": "fact-color.brown", "path": "color.dominant", "value": "brown", "state": "inferred", "provenance": "directly_visible", "confidence": 0.9, "evidenceReferenceIds": ["gpsref-0001"], "operatorConfirmed": false, "notes": "Lighting is not color-calibrated." },
      { "factId": "fact-upper.panelled", "path": "silhouette.upperTopology", "value": "multi_panel", "state": "inferred", "provenance": "directly_visible", "confidence": 0.9, "evidenceReferenceIds": ["gpsref-0001"], "operatorConfirmed": false, "notes": "Only lateral topology is supported." }
    ],
    "criticalUnknowns": ["medial panel topology", "outsole tread", "pair handedness", "rear center construction", "authenticated material composition"]
  },
  "lockedFactSet": {
    "lockSetVersion": "gps-locked-facts-v1.0.0",
    "status": "candidate_unlocked",
    "lockedFacts": [],
    "criticalUnknowns": ["medial panel topology", "outsole tread", "pair handedness", "rear center construction", "authenticated material composition"],
    "prohibitedAssumptions": ["Do not infer medial-side details from the lateral side", "Do not invent outsole tread", "Do not convert visible texture into authenticated material claims", "Do not assume a matched pair or handedness"],
    "lockedBy": null,
    "lockedAt": null
  },
  "facts": {
    "material": [
      { "factId": "fact-material.appearance", "path": "material.visibleAppearance", "value": "mixed smooth suede_like and perforated regions", "state": "inferred", "provenance": "directly_visible", "confidence": 0.78, "evidenceReferenceIds": ["gpsref-0001"], "operatorConfirmed": false, "notes": "Appearance only; composition and authenticity remain unknown." }
    ],
    "color": [
      { "factId": "fact-color.relationship", "path": "color.visibleRelationship", "value": "brown upper with lighter tan sole edge", "state": "inferred", "provenance": "directly_visible", "confidence": 0.89, "evidenceReferenceIds": ["gpsref-0001"], "operatorConfirmed": false, "notes": "No calibrated lighting." }
    ],
    "silhouette": [
      { "factId": "fact-silhouette.profile", "path": "silhouette.profile", "value": "low_top closed casual sneaker", "state": "inferred", "provenance": "machine_inferred", "confidence": 0.9, "evidenceReferenceIds": ["gpsref-0001"], "operatorConfirmed": false, "notes": "Family and use remain operator-reviewable." }
    ],
    "toe": [
      { "factId": "fact-toe.shape", "path": "toe.visibleShape", "value": "rounded", "state": "inferred", "provenance": "directly_visible", "confidence": 0.84, "evidenceReferenceIds": ["gpsref-0001"], "operatorConfirmed": false, "notes": "Exact top-view width is unknown." }
    ],
    "vamp": [
      { "factId": "fact-vamp.coverage", "path": "vamp.coverage", "value": "lace_obscured", "state": "uncertain", "provenance": "directly_visible", "confidence": 0.65, "evidenceReferenceIds": ["gpsref-0001"], "operatorConfirmed": false, "notes": "Centerline is not fully visible." }
    ],
    "openingCollar": [
      { "factId": "fact-opening.shape", "path": "opening.visibleShape", "value": "padded_low_collar", "state": "inferred", "provenance": "directly_visible", "confidence": 0.84, "evidenceReferenceIds": ["gpsref-0001"], "operatorConfirmed": false, "notes": "Interior depth is unknown." }
    ],
    "heelBack": [
      { "factId": "fact-heelback.center", "path": "heelBack.centerConstruction", "value": null, "state": "unknown", "provenance": "unknown", "confidence": 0, "evidenceReferenceIds": [], "operatorConfirmed": false, "notes": "Rear center is not directly shown." }
    ],
    "soleOutsole": [